[
  {
    "id": "file_automation",
    "title": "File Operations Automation",
    "description": "A simple script to automate file operations on your system. Demonstrates safe directory creation and file copying.",
    "filePath": "scripts/script_a.py",
    "readmeFile": "scripts/script_a_README.md",
    "tags": ["automation", "files", "beginner"],
    "author": "PythonMap",
    "lastUpdated": "2025-07-23T22:00:00Z",
    "dependencies": ["os", "shutil", "pathlib"],
    "annotationsFile": null
  },
  {
    "id": "data_analysis_utils",
    "title": "Data Analysis Utilities for Pandas",
    "description": "Helper functions for data manipulation and cleaning using Pandas. Includes trend analysis, outlier filtering, and data export capabilities.",
    "filePath": "scripts/project_x/util.py",
    "tags": ["data science", "pandas", "intermediate"],
    "author": "PythonMap",
    "lastUpdated": "2025-07-23T22:00:00Z",
    "dependencies": ["pandas", "numpy"],
    "annotationsFile": null
  }
]