{
  "id": "arcgis_utils",
  "title": "ArcGIS Utilities - Enterprise Connection Management",
  "description": "A comprehensive, production-ready utility for managing ArcGIS connections with enterprise-grade logging, performance monitoring, secure credential management, and robust SSL certificate handling.",
  "filePath": "scripts/arcgis_utils.py",
  "readmeFile": "scripts/arcgis_utils_README.md",
  "tags": ["GIS", "enterprise", "security", "automation", "advanced"],
  "author": "PythonMap",
  "lastUpdated": "2025-07-25T12:00:00Z",
  "dependencies": ["arcgis", "requests", "certifi", "keyring"],
  "annotationsFile": ".annotations/arcgis_utils_annotations.json"
}